user_input,retrieved_contexts,response,reference,faithfulness,answer_relevancy,context_recall,context_precision,nv_context_relevance
C'est quoi le job-dating pour les équipiers polyvalents à 59800 Lille et comment on peut participer?,"[""Title\n\n: La FRITERIE MEUNIER recrute des Equipiers Polyvalents de Restauration (H/F)\nDescription: La Friterie Meunier, spécialiste des recettes de notre région, recrute plusieurs équipiers polyvalents en restauration (Artisans fritiers (H/F)) pour 3 de ses points de vente sur Lille centre.\n\nExpérience d'au moins 3 mois en restauration appréciée.\n\nOuvert 7 jours sur 7,  vous avez 2 jours de repos consécutifs, planning continu, Travail journées soirs et weekend, et vous bénéficiez d'un parcours d'intégration et de formation assuré par leurs professionnels.\n\nVous souhaitez en savoir plus, rencontrer les recruteurs, présenter votre candidature !\n\nParticipez à ce job-dating ! \n \n\nEntretien individuel  avec le recruteur\nLocalisation: 59800 Lille\nVille:\n\nLille\nDate de début: 2025-03-20 09:00:00+00:00\nDate de fin: 2025-03-20T10:30:00+01:00\nAge Min: \nAge Max:"", ""Title\n\n: La FRITERIE MEUNIER recrute des Equipiers Polyvalents de Restauration (H/F)\nDescription: La Friterie Meunier, spécialiste des recettes de notre région, recrute plusieurs équipiers polyvalents en restauration (Artisans fritiers (H/F)) pour 3 de ses points de vente sur Lille centre.\n\nExpérience d'au moins 3 mois en restauration appréciée.\n\nOuvert 7 jours sur 7,  vous avez 2 jours de repos consécutifs, planning continu, Travail journées soirs et weekend, et vous bénéficiez d'un parcours d'intégration et de formation assuré par leurs professionnels.\n\nVous souhaitez en savoir plus, rencontrer les recruteurs, présenter votre candidature !\n\nParticipez à ce job-dating ! \n \n\nEntretien individuel  avec le recruteur\nLocalisation: 59800 Lille\nVille:\n\nLille\nDate de début: 2025-03-20 09:30:00+00:00\nDate de fin: 2025-03-20T11:00:00+01:00\nAge Min: \nAge Max:"", ""Title\n\n: La FRITERIE MEUNIER recrute des Equipiers Polyvalents de Restauration (H/F)\nDescription: La Friterie Meunier, spécialiste des recettes de notre région, recrute plusieurs équipiers polyvalents en restauration (Artisans fritiers (H/F)) pour 3 de ses points de vente sur Lille centre.\n\nExpérience d'au moins 3 mois en restauration appréciée.\n\nOuvert 7 jours sur 7,  vous avez 2 jours de repos consécutifs, planning continu, Travail journées soirs et weekend, et vous bénéficiez d'un parcours d'intégration et de formation assuré par leurs professionnels.\n\nVous souhaitez en savoir plus, rencontrer les recruteurs, présenter votre candidature !\n\nParticipez à ce job-dating ! \n \n\nEntretien individuel  avec le recruteur\nLocalisation: 59800 Lille\nVille:\n\nLille\nDate de début: 2025-03-20 08:00:00+00:00\nDate de fin: 2025-03-20T09:30:00+01:00\nAge Min: \nAge Max:"", ""Title\n\n: La FRITERIE MEUNIER recrute des Equipiers Polyvalents de Restauration (H/F)\nDescription: La Friterie Meunier, spécialiste des recettes de notre région, recrute plusieurs équipiers polyvalents en restauration (Artisans fritiers (H/F)) pour 3 de ses points de vente sur Lille centre.\n\nExpérience d'au moins 3 mois en restauration appréciée.\n\nOuvert 7 jours sur 7,  vous avez 2 jours de repos consécutifs, planning continu, Travail journées soirs et weekend, et vous bénéficiez d'un parcours d'intégration et de formation assuré par leurs professionnels.\n\nVous souhaitez en savoir plus, rencontrer les recruteurs, présenter votre candidature !\n\nParticipez à ce job-dating ! \n \n\nEntretien individuel  avec le recruteur\nLocalisation: 59800 Lille\nVille:\n\nLille\nDate de début: 2025-03-20 10:00:00+00:00\nDate de fin: 2025-03-20T11:30:00+01:00\nAge Min: \nAge Max:"", ""Title\n\n: La FRITERIE MEUNIER recrute des Equipiers Polyvalents de Restauration (H/F)\nDescription: La Friterie Meunier, spécialiste des recettes de notre région, recrute plusieurs équipiers polyvalents en restauration (Artisans fritiers (H/F)) pour 3 de ses points de vente sur Lille centre.\n\nExpérience d'au moins 3 mois en restauration appréciée.\n\nOuvert 7 jours sur 7,  vous avez 2 jours de repos consécutifs, planning continu, Travail journées soirs et weekend, et vous bénéficiez d'un parcours d'intégration et de formation assuré par leurs professionnels.\n\nVous souhaitez en savoir plus, rencontrer les recruteurs, présenter votre candidature !\n\nParticipez à ce job-dating ! \n \n\nEntretien individuel  avec le recruteur\nLocalisation: 59800 Lille\nVille:\n\nLille\nDate de début: 2025-03-20 08:30:00+00:00\nDate de fin: 2025-03-20T10:00:00+01:00\nAge Min: \nAge Max:""]","Le job-dating pour les équipiers polyvalents à 59800 Lille est un événement organisé par La Friterie Meunier, spécialiste des recettes de la région. Ils recrutent plusieurs équipiers polyvalents en restauration (Artisans fritiers) pour 3 de ses points de vente sur Lille centre.

Pour participer, vous pouvez vous inscrire via le lien suivant : [Inscription](https://mesevenementsemploi.francetravail.fr/mes-evenements-emploi/evenement/380336).

L'événement se déroulera le 20 mars 2025, de 08h30 à 12h00, avec des entretiens individuels avec les recruteurs. Vous aurez l'opportunité de rencontrer les recruteurs, de présenter votre candidature et d'en savoir plus sur les offres disponibles.","Le job-dating pour les équipiers polyvalents à 59800 Lille permet aux candidats de rencontrer les recruteurs et de présenter leur candidature. Il inclut un entretien individuel avec le recruteur et se déroule le 20 mars 2025, de 08h00 à 09h30.",0.8181818181818182,0.5688820697706214,1.0,0.99999999998,1.0
"What is the significance of Besançon in the context of the event ""Au-delà du mythe""?","['Title:\n\nSoirée ""Au-delà du mythe""\nDescription:\n\nAnimée par  Stanislas Frenkiel , historien (Université d’Artois), auteur de l’ouvrage Le football des immigrés, France Algérie, l’histoire en partage (Artois Presses Université, 2021) \n Avec la participation exceptionnelle de  Slim Rouaï,  fils de l’ancien footballeur professionnel  \n\nAmar\n\nRouaï  (Besançon et Angers), membre de l’équipe du FLN et de l’\n\néquipe nationale algérienne \n En parallèle de son exposition  \n\nVas-y champion !\n\nLe sport dans les années de Gaulle (1958-1969) , la Maison natale Charles de Gaulle vous invite à vous plonger au cœur de la Guerre d’Algérie et de la\n\nVe République naissante sous l’angle du football. \n \n\nDès 1958, 29 footballeurs professionnels algériens en activité en métropole rejoignent clandestinement Tunis et la base du FLN.\n\nAux yeux des autorités françaises, ils s’engagent au sein d’une organisation terroriste.\n\nDans cette sélection, ils mettent leur notoriété au service de leur pays.\n\nC’est l’un des plus célèbres exemples de la politisation du sport. \n \n\nLe football devient un exceptionnel outil de propagande dans la recherche de reconnaissance internationale.\n\nLes destins dorés des joueurs de cette équipe de la Liberté, devenus globe-trotteurs du ballon rond, renvoient chacun à la question du choix et du devoir\n\n. \n La soirée sera ponctuée de témoignages, de vidéos et d’archives. \n Durée : 1h30 \n Attention : places limitées !\n\nPensez à vous inscrire rapidement !   \n \n\nhttps://www.youtube.com/watch?v=x7C6qkIa6Xc&t=9s\n\n\nLocalisation: 9 rue Princesse 59000 LILLE\nVille: Lille\nDate de début:\n\n2025-01-30 17:30:00+00:00\n\n\nDate de fin: 2025-01-30T20:00:00+01:00\n\n\nAge Min: \nAge Max:', ""Title\n\n:\n\nOlivia Hernaïz, Les Heures Sont Là\nDescription:\n\nExposition du 25 avril au 26 septembre 2025 Vernissage, jeudi 24 avril à partir de 17h A partir de la crise de la Tulipomanie aux Pays-Bas au XVIIe siècle, considérée comme la première bulle spéculative de l’histoire\n\n, Olivia Hernaïz fait de cette fleur un symbole des excès et des dérives économiques.\n\nDes montagnes d’\n\nAsie centrale et d’Iran aux natures mortes européennes, en passant par les palais turcs\n\n, la tulipe comme objet de toutes les convoitises permet d’explorer notre rapport au vivant, au temps et à l’argent.\n\nEn transformant l’espace d’exposition en lieu d'échanges, de discussions et de transmission, l’artiste propose de participer à une Banque du Temps\n\n, comme alternative au système capitaliste actuel. \n Dans le cadre de Fiesta, 7e édition de lille3000, artconnexion présente Sobremesa : une exposition d'Olivia Hernaïz et des événements mettant en lumière l'action Nouveaux commanditaires.\n\nAvec le soutien de lille3000, de la Région Hauts-de-France, de la ville de Lille et de la Métropole Européenne de Lille.\n\nEn partenariat avec l'Accorderie de Lille.\n\n\nLocalisation: 9 Rue du Cirque Lille\nVille: Lille\nDate de début: 2025-04-24 15:00:00+00:00\n\n\nDate de fin: 2025-09-26T18:00:00+02:00\n\n\nAge Min: \n\n\nAge Max:"", 'Title:\n\nThe distorted party\nDescription:\n\nDans le cadre de Fiesta, 7ème édition de lille3000, le musée de l’Hospice Comtesse accueillera l’exposition  \n\nThe distorted party .\n\nAncienne institution religieuse offrant soins et abri aux personnes dans le besoin, le lieu est empreint d’ambivalences qui se retrouvent dans les thèmes de l’exposition : célébration et réflexion, chaos et beauté, distorsion et clarté. \n \n\nThe distorted party  repense la fête et la convivialité à des défis contemporains : le changement climatique, les inégalités sociales, l’instabilité politique et les inquiétudes qui persistent dans un monde post-covid.\n\nCes zones d’ombres soulignent la fragilité de l’existence humaine et détonnent avec les moments de célébration.\n\nL’euphorie de ces moments est parfois porteuse d’une introspection ou de malaises sous-jacents et dessine l’image surréaliste d’une fête souterraine \n Au-delà d’un sanctuaire historique, l’Hospice Comtesse devient une toile sur laquelle s’entrelacent et se renouvellent les sens de la fête.\n\nL’architecture paisible du lieu contraste vivement avec la scénographie moderne et l’énergie débordante, parfois troublante des œuvres. \n ----------------------   \n Commissariat : Siegrid Demyttenaere, co-fondatrice, co-rédactrice et directrice de la création.\n\ndu magazine DAMN° Sofie Lachaert, membre du duo de l’atelier d’artistes\n\nLachaert\n\nDhanis\n\n.   \n \n\nArtistes : Kenny Dunkan (FR), Willehad Eilers (NL/DE), Audrey Large (FR/NL) & Nadia Naveau (BE)   \n Avec le soutien technique d’Alive Group, mécène grand projet Fiesta Avec la participation de Flanders State of the Art \n ----------------------   \n BILLETTERIE   \n Individuels\n\nVisite libre :\n\nTarif plein : 7€ / Tarif réduit : 5€ → Visitez l’exposition gratuitement avec la C’ART, le City Pass, ainsi qu‘à l’occasion des Journées Européennes du Patrimoine, les 20 et 21 septembre 2025 \n Groupes\n\nInformations et réservations :', 'Title\n\n:\n\nEvery\n\n-\n\nBody\n\n-\n\nKnows\n\n-\n\nWhat\n\n-\n\nTomorrow\n\n-\n\nBrings\n\n-\n\nAnd\n\n-\n\nWe\n\n-\n\nAll\n\n-\n\nKnow\n\n-\n\nWhat\n\n-\n\nHappened\n\n-\n\nYesterday\n\n— Mohamed\n\nToukabri\nDescription: FESTIVAL LATITUDES\n\nCONTEMPORAINES\n\n#23\n\n5 — 27 juin   \n \n\nAvec son dernier solo, Mohamed Toukabri explore un territoire où le mouvement devient à la fois fouille archéologique et acte de révolte.\n\nUne plongée dans l’histoire de la danse qui interroge la transmission et la place de chaque corps dans l’héritage chorégraphique.\n\nConnu pour sa capacité à naviguer entre les mondes – de la rue à la scène, du hip-hop au postmodernisme, du personnel au politique\n\n–\n\nMohamed\n\nToukabri questionne dans sa nouvelle pièce les hiérarchies ancrées dans l’architecture même de la danse.\n\nQui peut bouger, comment et pourquoi ?\n\nUne performance qui respire l’urgence de décoloniser l’imagination, d’ouvrir un espace où les traditions dialoguent, où les danses longtemps considérées comme « moindres » trouvent toute leur place.\n\n«\n\nTout le monde sait ce que demain amène, et chacun·e sait ce qui s’est passé hier ».\n\nLe titre fonctionne à la fois comme une provocation et comme un rappel : le poids de l’histoire nous accompagne, et la danse de demain est façonnée par les choix d’aujourd’hui.\n\nUne invitation à la prise de responsabilité collective, à aller au-delà du connu, dans une danse où tous les corps, toutes les histoires, ont leur place. \n \n\nInformations accessibilité :\n\nTexte parlé en français, anglais et arabe, sur-titré en français Variations lumineuses rapides\nLocalisation: 70 Rue des Sarrazins, 59000 Lille\nVille:\n\nLille\nDate de début: 2025-06-24 18:30:00+00:00\nDate de fin: 2025-06-24T22:00:00+02:00\n\n\nAge Min: \n\n\nAge Max:', 'Title:\n\nSensibilisation sur l’importance des jardins\nDescription:\n\nDécouvrez un lieu chargé d’histoire, transformé au fil du temps, et son jardin devenu un espace privilégié de repos, d’échanges, de jeux et de fêtes.\n\nVisites, jeux et ateliers vous feront réaliser toute l’importance d’un jardin en ville !\nLocalisation: 56 façade de l’Esplanade\nVille:\n\nLille\nDate de début: 2025-06-07 12:00:00+00:00\nDate de fin: 2025-06-07T17:30:00+02:00\n\n\nAge Min: \n\n\nAge Max:']","La signification de Besançon dans le contexte de l'événement ""Au-delà du mythe"" est liée à la participation exceptionnelle de Slim Rouaï, le fils de l'ancien footballeur professionnel Amar Rouaï. Amar Rouaï a joué à Besançon et à Angers, et il était membre de l'équipe du FLN et de l'équipe nationale algérienne. Cet événement explore le rôle du football pendant la Guerre d'Algérie et la Ve République naissante, mettant en lumière des figures comme Amar Rouaï et leur impact historique.","Besançon is significant in the context of the event ""Au-delà du mythe"" as it is the hometown of Slim Rouaï, the son of former professional footballer Amar Rouaï. Slim Rouaï is a notable participant in the event, which explores the intersection of football, politics, and society, particularly during the Algerian War and the early years of the Fifth Republic.",0.8333333333333334,0.7228257572365382,0.5,0.9999999999,1.0
What job opportunities are available at La Friterie Meunier in Lille?,"[""Title:\n\nJob dating: spécial métiers de l'industrie\nDescription: Jobdating spécial métiers de l'industrie !\n\nVous cherchez un emploi et souhaitez découvrir un secteur qui recrute toute l'année ?\n\nCet événement est fait pour vous !\n\nVenez participer à un jobdating en partenariat avec la Marine Nationale, Manpower et Alkine.\n\nRencontrez directement les employeurs et découvrez :\n\n- Des offres d'emploi variées (mécanicien industriel, opérateur de maintenance aéronautique, opérateur de production, etc...\n\n- Une diversité de métiers dans le secteur de l'industrie\n\n- Des m\nLocalisation: 59000 Lille\nVille:\n\nLille\nDate de début: 2025-11-19 13:00:00+00:00\nDate de fin: 2025-11-19T16:00:00+01:00\nAge Min: \nAge Max:"", 'Startups, industriels, experts et institutions y trouveront un terrain propice à l’innovation et à la création de projets à forte valeur ajoutée pour le territoire. \n \n\nFrench Tech\n\nLille invite\n\nl’\n\nensemble\n\nde l’écosystème industriel et technologique\n\nà participer à cette journée stratégique\n\n,\n\nà explorer de nouvelles solutions et à contribuer à la transformation de l’industrie régionale.\n\n\nLocalisation: Place du Théâtre, Lille, France\nVille:\n\nLille\nDate de début: 2025-11-25 08:30:00+00:00\nDate de fin: 2025-11-25T21:30:00+01:00\nAge Min: \nAge Max:', ""Ceux-ci ne participeront de ce fait pas au recrutement.\n\nL'enseigne recrute avec POE des Employés polyvalent de restauration (H/F)et hors POE, des Manager (H/F) et Assistant manager (H/F)\nLocalisation: 59800 Lille\nVille: Lille\nDate de début: 2025-03-03 12:30:00+00:00\nDate de fin: 2025-03-03T16:30:00+01:00\nAge Min: \nAge Max:"", ""Ceux-ci ne participeront de ce fait pas au recrutement.\n\nL'enseigne recrute avec POE des Employés polyvalent de restauration (H/F)et hors POE, des Manager (H/F) et Assistant manager (H/F)\nLocalisation: 59800 Lille\nVille: Lille\nDate de début: 2025-03-03 08:00:00+00:00\nDate de fin: 2025-03-03T12:30:00+01:00\nAge Min: \nAge Max:"", ""Ceux-ci ne participeront de ce fait pas au recrutement.\n\nL'enseigne recrute avec POE des Employés polyvalent de restauration (H/F)et hors POE, des Manager (H/F) et Assistant manager (H/F)\nLocalisation: 59800 Lille\nVille: Lille\nDate de début: 2025-03-10 12:30:00+00:00\nDate de fin: 2025-03-10T16:30:00+01:00\nAge Min: \nAge Max:""]","Je suis désolé, mais je n'ai pas trouvé d'informations spécifiques sur les opportunités d'emploi à La Friterie Meunier à Lille dans les résultats de recherche. Il serait préférable de consulter directement le site web de La Friterie Meunier ou de les contacter pour obtenir les informations les plus récentes sur les postes disponibles.","La Friterie Meunier is recruiting several polyvalent restaurant team members (Artisans fritiers) for three of its locations in Lille city center. They prefer candidates with at least 3 months of experience in the restaurant industry. The establishment is open 7 days a week, offering 2 consecutive days off, with a continuous schedule that includes work during days, evenings, and weekends. They provide an integration and training program conducted by professionals. Interested candidates can participate in a job-dating event to meet recruiters and present their applications.",0.0,0.0,0.2,0.0,0.0
"What cultural event is taking place in Moulins on March 29, 2025?","['Title:\n\nLe planétarium itinérant à Moulins\nDescription: Séances pour les individuels : Lundi 7 juillet à 10h, 11h10 & à 16h20 Mardi 8 juillet à 11h10 & à 16h20 Lieu : Salle Courmont, 2 rue Courmont, Lille-Moulins \n Gratuit\n\n- En accès libre dans la limite des places disponibles Merci de vous présenter 10 minutes avant le début de la séance Durée : 1h\n\n- À partir de 9 ans\nLocalisation: 2 Rue Courmont, 59000 Lille\nVille: Lille\nDate de début: 2025-07-07 08:00:00+00:00\nDate de fin: 2025-07-08T17:30:00+02:00\n\n\nAge Min:\n\n9.0\nAge Max: 99.0', ""Title:\n\nLes Fiestas du Tripo :\n\nCOSMIC LOVE SESSION\nDescription: 🌌 COSMIC LOVE x FIESTA x L'ARTY BAR\n\n– TRIPOSTAL LILLE\n\n🌈 \n \n\nDancefloor éclectique tenu par des DJs qui vont faire vibrer le Tripostal aux rythmes de la house, de la disco et de la techno.\n\nLa scène locale et parisienne s’invitent aux platines pour une nuit de sets groovy et sportifs\n\n— une fête cosmique dans l’esprit de Fiesta, entre culture et danse. \n \n\n🪩 ❤️\n\nPROGRAMME \n 18h\n\n– 19h30 :\n\nAccès exceptionnel à l’exposition\n\nPom Pom Pidou, un récit renversant de l’art moderne sur présentation du billet de la soirée \n 19h30 :\n\nCours de VOGA par MINIRINE Quand fitness, mode et yoga se rencontrent : un flow stylé, rythmé, inspiré par l’art et le mouvement.\n\nGet ready to strike a pose! \n \n\n🎶 22h\n\n– 2h : Cosmic\n\nLove Party GUESSAÏ KUBEBE\n\nCANDY KRUSH\n\nFARAÏ & COSMIC GRRRLLL\n\nCLARENCE BODDICOEUR (Live House) \n 🔥\n\nAfterparty\n\n–\n\nNOX CLUB (2h – 6h)\n\n- Gratuit L’expérience se poursuit jusqu’au lever du jour\n\n— la fête ne s’arrête jamais 💫 \n 📍\n\nTripostal\n\n–\n\n22 avenue Willy Brandt\n\n, Lille \n Bar et Restauration sur place.\n\n\nLocalisation: 22 avenue Willy Brandt\nVille: Lille\nDate de début: 2025-10-18 16:00:00+00:00\n\n\nDate de fin: 2025-10-19T02:59:00+02:00\n\n\nAge Min: \n\n\nAge Max:"", ""Title:\n\nNEXT Festival : Erste Schritte zu den\n\nSchwellen\nDescription:\n\nDans une lente procession, des personnages masqués dansent ensemble.\n\nDes clochettes suspendues entre leurs omoplates tintent à chacun de leurs mouvements.\n\nZwoisy Mears-\n\nClarke\n\ninvite ainsi le public à participer à une nouvelle danse folklorique, mêlant narration, danse et audiodescription.\n\nInspirée des traditions masquées allemandes visant à chasser l'hiver, cette procession a pour but d'ébranler les structures coloniales locales qui persistent encore aujourd'hui. \n Samedi : 13h30 et 15h30\n\nDimanche :\n\n15h00 (Durée : 45 min)\nLocalisation:\n\n17 bd Jean Baptiste Lebas\nVille: Lille\nDate de début: 2025-11-08 12:30:00+00:00\nDate de fin: 2025-11-09T15:45:00+01:00\nAge Min: \nAge Max:"", 'Title:\n\nLIVE AND SANDWICH\nDescription: XIII\n\nAMER\n\nIl incarne une fusion peu commune en associant les rythmes percutants du rap à l’authenticité brute du grunge & à l’intensité rebelle de l’énergie punk. \n \n\nLes débuts sur scène de XIII ont commencé en septembre 2019, lors de concertstels que les premières parties de 77 & Alaclair Ensemble, Nusky, Hippocampe Fou, Dooz Kawa, Kacem Wapalek, 13 Bloc, Julien Granel, Swift Guad, ainsi que des apparitions dans des festivals tels que le Xu Festival, Les Nuits Secrètes, La Bonne Aventure, En Nord Beat festival, Open Estival & le Crossroad Festival.\n\n\nLocalisation: 22 avenue Willy Brandt\nVille: Lille\nDate de début: 2025-05-30 10:30:00+00:00\n\n\nDate de fin: 2025-05-30T14:00:00+02:00\n\n\nAge Min: \n\n\nAge Max:', ""Title:\n\nJournée Européennes du Patrimoine à la maison Folie Moulins\nDescription:\n\nVisites guidées de la maison Folie\n\nMoulins \n Samedi 20 & dimanche 21 septembre à 15 h 30 & 17 h\n\nNichée\n\nau cœur du quartier de Moulins,\n\nla maison Folie a pris place dans les anciens bâtiments d’une brasserie construite au XIXème siècle.\n\nLes traces du passé industriel sont encore visibles mais l’activité a bien changé.\n\nRéhabilitée au début des années 2000, la structure abrite aujourd’hui de nombreux projets artistiques pluridisciplinaires.\n\nGrâce à la multiplicité de ses espaces et à l’ambiance de sa cour intérieure, elle est l’écrin d’un brassage de propositions, d’artistes et de publics, en lien avec de nombreux partenaires de la métropole lilloise et au-delà.\n\nGratuit, sur réservation (COMPLET)\n\nDurée 45 min Tout public \n \n\nVisites\n\nguidées de l'exposition   \n\nFuego y Veneno \n Samedi 20 & dimanche 21 septembre à 16 h L’inévitable\n\nPilar Albarracín\n\n- reconnue dans le paysage artistique international\n\n– expose à la Maison\n\nFolie Moulins\n\n.\n\nElle y propose de nouvelles productions inspirées du mantón de Manila, châle traditionnel espagnol porté lors des festivités.\n\nDans cette exposition, elle aborde avec humour l’héritage culturel, le rituel et les stéréotypes.\n\nElle déconstruit le faux moralisme dissimulé derrière les clichés et combat l’essentialisme qui conçoit les identités comme quelque chose de statique.\n\nDans le cadre de Fiesta, 7ème édition de lille3000 Gratuit, sur réservation Durée 45 min Tout public\n\nL'exposition sera exceptionnellement ouverte jusqu'à 20 h le samedi 20 septembre ! \n \n\nAtelier BD au Mini-Lab \n Samedi 20 septembre de 15 h à 18 h Viens illustrer une aventure du Mini-Lab en BD !\n\nAvec l’aide de l’artiste\n\nFaune de la maison d’\n\nédition\n\nLa Boucle du Dessin et en t’inspirant de l’architecture, crée ta propre planche, qui sera imprimée dans un livret spécial à retrouver au Mini-Lab.\n\nÀ vos crayons\u202f!""]",Il n'y a pas d'événement culturel à Moulins le 29 mars 2025.,"On March 29, 2025, a cultural event titled 'Comptines et chansons à la bibliothèque' will take place in Moulins. This event features comptines and songs with Jérôme and his guitar, organized by the association Filofil, aimed at enchanting the ears of children aged 0-3. It will be held at the médiathèque de Moulins, promoting shared reading and musical listening.",1.0,0.6437830070837316,0.0,0.0,0.5
Who is Laura BATTINI and what she do for CNRS?,"['Title\n\n: NATASHA\n\nPENOT & MARK TRANMER\nDescription:\n\nNatasha Penot  (Grisbi, The Apartments) et  Mark\n\nTranmer  (\n\nThe Montgolfier Brothers, Vetchinsky Settings, Gnac, St Christopher) font revivre le répertoire des Montgolfier Brothers, à l’occasion de la sortie de la compilation «\n\nThink\n\nOnce\n\nMore\n\n– A Journey with\n\nThe Montgolfier Brothers ».\n\nSite web Facebook Youtube\nLocalisation: 79 rue Colbert, 59000 Lille\nVille:\n\nLille\nDate de début: 2025-11-28 19:00:00+00:00\nDate de fin: 2025-11-28T22:00:00+01:00\nAge Min: \nAge Max:', ""Title:\n\nFemmes, regards singuliers, voix plurielles\nDescription: 14h30 : GRANDES ET PETITES (programme de 5 courts métrages, 52min) À travers cinq courts documentaires singuliers, ce programme propose un voyage délicat entre mémoire, transmission et regards d’enfants.\n\nEntre confidences, dessins, magie et réflexions sur le féminin, se dessine un ensemble sensible où se croisent histoires personnelles et questionnements universels.\n\nVenez rencontrer Antoinette, Ginette et les autres !\n\nÀ partir de 8 ans.\n\nEn partenariat avec les Rencontres Audiovisuelles. \n 16h : MARION MOTIN :\n\nDANSE AVEC LA LOUVE de Anne Cutaia (2021, 57min)\n\nLa trajectoire de la danseuse et chorégraphe Marion Motin est hors du commun.\n\nPassionnée de hip hop, cette autodidacte est devenue une artiste convoitée par les plus grands de la pop internationale.\n\nElle signe les chorégraphies de Madonna, Stromae, Christine&The Queens ou Angèle mais aussi celle des comédie musical à succès comme Résiste de France Gall et le Fashion Freak Show de JP Gaultier.\n\nAvant d’être un nom, Marion est une signature chorégraphique inimitable. \u2028\n\nAprès avoir beaucoup créé pour les autres, c'est un nouveau défi l’attend.\n\nUne création plus personnelle, qu’elle signe en son nom :\n\nLe Grand Sot.\n\nAu fil du compte à rebours de la première de ce spectacle, à travers son quotidien intense et les témoignages de sa famille et des ses collaborateurs, le film cherche à percer le mystère de cette femme puissante, à l'univers créatif foisonnant que l'on surnomme : la louve.\n\nEn partenariat avec Heure Exquise ! et le Flow.   \n \n\n18h :\n\nELEKTRO MATHEMATRIX de Bianca\n\nLi (2015, 1h20)\n\nElektro Mathematrix  est une comédie musicale urbaine.\n\nDrôle, sensible et sans aucun dialogue, ce film, entièrement chorégraphié, propose une vision positive de la vie quotidienne dans un lycée, celle de jeunes drôles et créatifs, jouant avec humour leurs amitiés, leurs rivalités, leurs inquiétudes et leurs espoirs...\n\nEn partenariat avec Heure"", ""Title:\n\nLooking for Martha\n\n–\n\nCie\n\nLes Chiennes Savantes\nDescription:\n\nHFX+, collectif Hautement Féministe, s’associe une nouvelle fois à la maison Folie Wazemmes pour la soirée de lancement des Journées du Matrimoine dans les Hautes de France.\n\nUn événement qui permettra de retracer le parcours de Martha Desrumaux, ouvrière textile, militante syndicale, communiste et résistante, dans l’endroit même qui porte son nom dans cette ancienne usine textile aujourd’hui devenue maison Folie Wazemmes. \u202f Y’a\n\nquelques temps et trop récemment, on a découvert une femme exceptionnelle : Martha Desrumaux.\n\nEt comme on est 5 copines créatrices, ça nous a donné une furieuse envie de partir à sa recherche, de partager sa puissance et de gueuler son nom encore et encore pour qu’elle enflamme notre mémoire, notre cœur, notre rage.\n\nQu’on apporte notre brique pour construire l’histoire qu’on nous a volé. \n \n\nGratuit Durée  50 minutes À partir de  14 ans Vendredi 19 septembre , 19 h 30\n\nPremière représentation !\n\nSoirée d’ouverture des journées européennes du matrimoine organisée par le collectif HFX+.\n\nLa représentation sera suivie d’un blind test par Scrimmage People jusque 22h puis d'un DJ set enflammé à l’Auberge de la maison Folie Wazemmes.\n\n-------------------------- Administratrice : Célia Kwasniewski ;\n\nMotivatrice de meute : Charlotte Talpaert ;\n\nAutrice : Véronika Boutinova (ainsi que pleins de copaines autrices qui nous nourrissent) ;\n\nMise en scène collective ;\n\nInterprétation :\n\nSofia Kacer et Charlotte Talpaert, bientôt rejoint par Pauline Huyghe ;\n\nCréation et mapping vidéo : Marie Cornier alias MAÏA\nLocalisation: 70 Rue des Sarrazins, 59000 Lille\nVille: Lille\n\n\nDate de début: 2025-09-19 17:30:00+00:00\nDate de fin: 2025-09-19T20:20:00+02:00\n\n\nAge Min:\n\n14.0\nAge\n\nMax:\n\n99.0"", ""Title:\n\nSpectacle de marionnettes à la bibliothèque\nDescription: Marionnettes : la forêt est en effervescence\n\n, les animaux décident d’organiser la fête des voisins.\n\nMais tout ne va pas se dérouler comme prévu, et l'aide du public sera essentielle pour que la fête ait bien lieu.\n\nUn spectacle créé par les bibliothécaires lillois, à découvrir en famille !\nLocalisation: 8 allée de la Filature\nVille: Lille\nDate de début: 2025-07-09 13:30:00+00:00\nDate de fin: 2025-07-09T16:00:00+02:00\nAge Min: 4.0\nAge Max: 99.0"", ""Title:\n\nBibliothèque sensorielle\nDescription: Bibliothèque sensorielle pour les 4-8 ans\n\nUne expérience à vivre pour les enfants accompagnés de leurs parents, autour d’une lecture et d’un atelier créatif.\n\nMédiation asurée par l'association\n\nLes Papillons Blancs, autour du thème du Printemps de l'accessibilité 2025\nLocalisation: 205 bis, rue  Faubourg de Roubaix\nVille: Lille\nDate de début: 2025-05-14 13:00:00+00:00\nDate de fin: 2025-05-14T17:00:00+02:00\n\n\nAge Min:\n\n4.0\nAge Max:\n\n8.0""]",Je n'ai pas d'informations sur Laura Battini et son travail pour le CNRS.,Laura BATTINI is a researcher at CNRS who is involved in workshops that explore the maternities of Egypt and Mesopotamia.,1.0,0.0,0.0,0.0,0.0
