user_input,retrieved_contexts,response,reference,faithfulness,answer_relevancy,context_recall,context_precision,nv_context_relevance
Y a-t-il un atelier numérique pour aider les seniors à utiliser des outils numériques?,"['Title:\n\nCOMPLET\n\n- Atelier numérique “\n\nHackons ensemble les objets du quotidien”\nDescription: Et si on apprenait ensemble à réparer plutôt qu’à jeter ?\n\nDans cet atelier collaboratif, les seniors apportent des objets du quotidien (radio, téléphone, petits appareils électroménagers…) et les jeunes mettent leurs compétences numériques à contribution pour trouver des solutions de réparation en ligne.\n\nUne manière ludique d’associer savoir\n\n-faire manuel et culture digitale, pour une transmission de compétences dans les deux sens !\n\n\nLocalisation:\n\n19 rue Nicolas Leblanc 59000 Lille\nVille: Lille\nDate de début: 2025-06-01 12:30:00+00:00\nDate de fin: 2025-06-01T17:00:00+02:00\nAge Min: \nAge Max:', 'Title:\n\n""15 comptez-vous !"" : rencontre avec l\'autrice Anne Lesaffre\nDescription:\n\nUn formidable portrait de famille, un pari d\'éducation passionnant et un tableau tout en nuances d\'une époque.\n\nEn 1948, devant une assistance d’enseignants et de parents d’élèves des facultés catholiques de Lille, un industriel du Nord donne une conférence sur l’éducation hors-norme que sa femme et lui ont développée pour leurs enfants.\n\nIls en ont déjà onze et quatre autres vont suivre.\n\nManon\n\n– c’est son surnom – est la numéro douze.\n\nAvec le recul d’une vie, elle raconte.\n\nElle raconte l’histoire à la saveur aigre-douce d’une fratrie de quinze frères et sœurs qui vivent isolés de la société qui les entoure.\n\nLa demeure est grande et délabrée, le jardin immense, les enfants, livrés à eux-mêmes, y font les quatre cents coups.\n\nMais le père, marqué par la guerre, en a retenu qu’il faut rendre les jeunes physiquement et moralement aptes à vaincre.\n\nCela va signifier vie spartiate, maîtrise des émotions, courage, dignité, les principes avant tout, aux dépens des sentiments.\n\nDans ce texte superbement écrit, enlevé, où sérieux et humour se conjuguent, l’auteure soulève le voile sur une « grande famille du Nord » totalement atypique, avec réalisme quant aux dérives d’une éducation se voulant idéale, mais aussi aux enseignements qu’elle leur apportait, et avec tendresse car cette famille, c’est la sienne.\n\n\nLocalisation: 32-34 Rue Edouard Delesalle, 59000 Lille\nVille:\n\nLille\nDate de début: 2025-10-10 15:30:00+00:00\nDate de fin: 2025-10-10T18:30:00+02:00\n\n\nAge Min: 15.0\nAge Max:\n\n99.0', ""Title:\n\nConférence et dédidace avec Michel Pastoureau\nDescription:\n\nMercredi 22 octobre, rendez-vous au Tripostal pour une  conférence et une séance de dédicace exceptionnelle avec Michel Pastoureau. \n L'auteur fera une conférence de 15h à 15h30 puis sera en dédicace jusqu'à 17h30. \n \n\nVoici les ouvrages publiés chez Dervy qui seront mis en avant\n\n: \n \n Couleurs et fruits au Moyen Âge \n \n \n\nSymboles du Moyen Âge.\n\nAnimaux, végétaux, couleurs, objets \n \n \n\nDictionnaire encyclopédique des couleurs au Moyen-Age \n \n \n \n\nUne rencontre à ne pas manquer en partenariat avec le Furet du Nord !\nLocalisation: 22 avenue Willy Brandt, 59777 Lille\nVille: Lille\nDate de début: 2025-10-22 13:00:00+00:00\nDate de fin: 2025-10-22T17:30:00+02:00\n\n\nAge Min: \n\n\nAge Max:"", 'DERNIÈRES\n\nINSCRIPTIONS Rendez-vous à la Salle Camelot (Rue de la Halle 59000 Lille) les 21 et 22 mai de 9h à 13h.\n\nTarif : 7€ le mètre linéaire pour un minimum de réservation de 2 mètres linéaires.\n\nRéglement par chèque ou espèces. \n Lors des réservations, il vous sera demandé : \n \n une copie recto-verso de votre pièce d’identité \n une copie d’un justificatif de domicile datant de moins de 3 mois \n une copie recto-verso de la carte grise du véhicule si besoin d’entrer dans le périmètre \n \n Il sera demandé en plus aux professionnels : \n \n une copie de l’extrait k-bis de moins de 3 mois ou du registre du commerce \n une copie de la carte «\n\nactivité commerciale ambulante » pour les commerçants non sédentaires \n une copie de récépissé « revendeurs d’objets mobiliers » pour les brocanteurs professionnels \n une copie du récépissé de déclaration en préfecture pour les associations \n\nLocalisation: Vieux-Lille\nVille: Lille\nDate de début: 2025-06-07 07:00:00+00:00\n\n\nDate de fin: 2025-06-07T20:00:00+02:00\n\n\nAge Min: \n\n\nAge Max:', ""Title\n\n: Mercredi C'est Broderie !\nDescription:\n\nVous avez entre 16 et 99 ans ?\n\nProfitez d'ateliers gratuits intergénérationnels pour créer ou personnaliser des vêtements et accessoires upcyclés autour du thème : 1965-2025, les années 60 revisitées.\n\nChapeau, foulard, t-shirt, venez avec votre sandwich et le vêtement de votre choix pour cet atelier qui aura lieu dans le jardin\n\ns’il fait beau.\n\nNe manquez pas les ateliers de la Maison Folie\n\nMoulins les dimanches 27 avril et 4 mai entre 14h et 18h !\nLocalisation: 32\n\n-34 Rue Edouard Delesalle, 59000 Lille\nVille: Lille\nDate de début: 2025-04-30 10:00:00+00:00\n\n\nDate de fin: 2025-05-28T14:00:00+02:00\n\n\nAge Min: 16.0\nAge Max:\n\n99.0""]","Oui, il y a un atelier numérique pour aider les seniors à utiliser des outils numériques. L'atelier s'intitule ""Hackons ensemble les objets du quotidien"" et aura lieu le 1er juin 2025 à Lille. Cet atelier collaboratif permet aux seniors d'apporter des objets du quotidien (radio, téléphone, petits appareils électroménagers, etc.) tandis que les jeunes mettent leurs compétences numériques à contribution pour trouver des solutions de réparation en ligne. C'est une manière ludique d'associer savoir-faire manuel et culture digitale, pour une transmission de compétences dans les deux sens. L'atelier se déroulera à l'adresse suivante : 19 rue Nicolas Leblanc, 59000 Lille, de 12h30 à 17h00.","Atelier numérique ""Hackons ensemble les objets du quotidien"" / Les jeunes aident les seniors à comprendre et utiliser des outils numériques, tandis que les seniors enseignent des astuces pour bricoler et réparer au lieu de jeter.",0.8888888888888888,0.9668069480645015,1.0,0.9999999999,0.75
Comment puis-je connaître l'histoire de ma maison?,"['Title:\n\nAtelier ""Des clés pour faire l’histoire\n\nd’\n\nune maison""\nDescription:\n\nVous possédez une maison de famille ?\n\nVous venez d\'acheter une ferme ancienne ?\n\nOu vous êtes tout simplement curieux de connaître l\'histoire d\'un lieu ?\n\nVous avez de bonnes raisons de venir découvrir les différents documents d’archives pour vous y aider.\n\nLes agents des Archives départementales vous présenteront les différentes étapes à suivre pour mener vos recherches. \n \n \n\nSamedi à 14h30 et 16h30 \n \n \n\nDimanche\n\nà 10h30, 14h et 16h \n \n Durée :\n\n1h30 \n \n Sur réservation \n \n Adultes \n \n\nLocalisation: 22 rue Saint-Bernard, 59000 Lille\nVille: Lille\nDate de début: 2025-09-20 12:30:00+00:00\nDate de fin: 2025-09-21T17:30:00+02:00\nAge Min: \nAge Max:', ""Title:\n\nVisite de la rénovation complète d'une maison ancienne Lilloise.\nDescription: À l’occasion des Journées Nationales de l’Architecture 2025, nous ouvrons exceptionnellement les portes d’un chantier en plein cœur de Lille.\n\nIl s’agit d’une maison de famille datant de la fin du XVIIIe siècle, actuellement en cours de rénovation complète.\n\nLe projet, mené en plusieurs phases, poursuit un double objectif : \n \n restaurer et valoriser les matériaux existants (boiseries, planchers, décors anciens) ; \n offrir un confort contemporain dans le respect du caractère historique des lieux. \n \n \n\nLa visite sera animée par les architectes en charge du projet.\n\nVous pourrez y découvrir certains espaces déjà transformés, parcourir ceux encore dans leur état d’origine et comprendre les choix de conception qui guident cette métamorphose.\n\nUn moment privilégié pour entrer dans les coulisses d’un chantier et dialoguer autour du patrimoine, de l’architecture et de l’art de vivre.\nLocalisation: 1 Grand'Place 59000 Lille\nVille: Lille\nDate de début: 2025-10-16 15:00:00+00:00\nDate de fin: 2025-10-18T19:00:00+02:00\nAge Min: \nAge Max:"", ""Faune de la maison d’\n\nédition\n\nLa Boucle du Dessin et en t’inspirant de l’architecture, crée ta propre planche, qui sera imprimée dans un livret spécial à retrouver au Mini-Lab.\n\nÀ vos crayons\u202f!\n\nGratuit, sur réservation :  microfolie@mairie-lille.fr À partir de 10 ans \n Fresque participative au musée Numérique \n Samedi 20 septembre & dimanche 21 septembre de 15 h à 18 h Explore l’architecture unique de la maison Folie Moulins et laisse libre cours à ta créativité.\n\nGuidé·es par l’artiste Princesse\n\nTofu Soyeux de la maison d’\n\nédition\n\nLa Boucle du Dessin, tu pourras imaginer, dessiner ou écrire ta vision du lieu directement sur les murs du musée numérique.\n\nGratuit, sans réservation À partir de 3 ans \n _____\n\n_\n\nHoraires d'ouverture de la maison Folie Moulins :\n\n- samedi 20 septembre : 15 h à 20 h\n\n- dimanche 21 septembre : 15 h à 19 h\nLocalisation: 47/49 rue d'Arras Lille\nVille: Lille\nDate de début: 2025-09-20 13:00:00+00:00\nDate de fin: 2025-09-21T19:00:00+02:00\n\n\nAge Min: \n\n\nAge Max:"", ""Title:\n\nLe musée d'Histoire\n\nNaturelle au Palais des Beaux-Arts !\n\n\nDescription:\n\nLe Musée d'Histoire\n\nNaturelle vous fera découvrir ses collections grâce à une malle d'objets pédagogiques et lèvera un voile sur la rénovation en cours de leur musée !\n\nRendez-vous dans la salle des plans-relief au niveau -1.\n\n\nLocalisation: Place de la République (Lille), 59000 Lille, France\nVille:\n\nLille\nDate de début: 2025-05-17 16:00:00+00:00\nDate de fin: 2025-05-17T23:50:00+02:00\nAge Min: \nAge Max:"", 'Title:\n\nRencontres et Dédidaces avec Marguerite Abouet\nDescription: Autrice, scénariste et réalisatrice ivoirienne, Marguerite Abouet s’est fait connaître avec sa célèbre\n\nsérie\n\n \n\nAya de Yopougon , best-seller adapté en film d’animation en 2013.\n\nElle continue aujourd’hui d’écrire pour la télévision et le cinéma, tout en dirigeant l’association Des livres pour tous, qui favorise l’accès à la lecture en Afrique. \n À l’occasion de Fiesta, Marguerite Abouet sera à Lille pour une serie de  rencontres et dédicaces  autour de son dernier ouvrage, le roman-photo  Les Amours de Machérie , publié aux éditions du Seuil : Samedi 24 mai à partir de 15h   au sein de l’exposition « À Babi la Belle » à la Maison St\n\nSo (Gare Saint Sauveur, Lille).   \n \n\nDécouvrez l’exposition\n\n«\n\nÀ Babi la Belle » à la Maison St\n\nSo Vivez une expérience immersive et participative au cœur des décors de Les Amours de Machérie, entre studio photo, ambiance de rue abidjanaise.\n\nCréez également votre propre roman-\n\nphoto\n\nen participants aux ateliers\n\n!\nLocalisation:\n\n17 Bd\n\nJean-Baptiste Lebas, 59800 Lille\nVille: Lille\nDate de début: 2025-05-24 13:00:00+00:00\n\n\nDate de fin: 2025-05-24T17:00:00+02:00\n\n\nAge Min: \n\n\nAge Max:']","Pour connaître l'histoire de votre maison, vous pouvez participer à l'atelier ""Des clés pour faire l’histoire d’une maison"" organisé par les Archives départementales du Nord. Cet atelier vous présentera les différentes étapes à suivre pour mener vos recherches à l'aide de divers documents d’archives.

L'atelier se déroulera le samedi 20 septembre et le dimanche 21 septembre 2025 à Lille, aux Archives départementales du Nord, 22 rue Saint-Bernard. Les sessions sont programmées à 14h30 et 16h30 le samedi, et à 10h30, 14h et 16h le dimanche. Chaque session dure 1h30 et nécessite une réservation. Pour plus d'informations ou pour vous inscrire, vous pouvez contacter les Archives départementales par email à archivedep@lenord.fr ou par téléphone au 0359730600.","Lors des Journées européennes du patrimoine 2025, participez à l'atelier 'Connaître l'histoire de sa maison' pour découvrir les secrets de votre habitation.",0.8571428571428571,0.9673971301852285,0.0,0.9999999999,1.0
Mes enfants ont 14 et 16 ans. Existe t'il des camps d'une ou deux semaines cet été pour moins de 1000 euros?,"[""Title:\n\nCamps d'été pour collégiens et lycéens\nDescription: du 18 au 25 juillet : camp Cap Nord pour les 11-14 ans entre 250€ et 350€ du 18 au 31 : camp Meurthe et Mos'\n\nArt (54) pour les 13-15 ans entre 450€ et 650 € du 21 juillet au 3 août : camp des Zazous (Tarn 81) pour les 15-17 ans entre 450€ et 650€\nLocalisation: rue hippolyte lefebvre lille\nVille: Lille\nDate de début: 2025-07-14 06:00:00+00:00\n\n\nDate de fin: 2025-07-20T08:30:00+02:00\n\n\nAge Min: 11.0\nAge\n\nMax\n\n:\n\n17.0"", 'Au programme : dans la journée, un bal pour les enfants et un atelier danse pour petits et grands.\n\nEn soirée, place au bal pour tous, avec buvette et barbecue dans le jardin du Tire-Laine.\n\nUne dernière occasion de découvrir le Mini Muséum de quartier avant sa fermeture !\nLocalisation: 50 rue de Thumesnil\nVille: Lille\nDate de début: 2025-08-20 08:00:00+00:00\nDate de fin: 2025-08-30T17:00:00+02:00\n\n\nAge Min: \n\n\nAge Max: 99.0', 'Title:\n\nAtelier créatif\nDescription:\n\nParticipez à notre atelier parents\n\n-enfants spécialement conçu pour les enfants de 5 à 10 ans, une expérience INDISPENSABLE à vivre en binôme !\n\nCet atelier privilégie la complicité et l’échange entre l’enfant et son parent, autour d’activités ludiques et éducatives qui renforcent le lien familial.\n\nOrganisé par L’École et son quartier, ce moment convivial invite petits et grands à partager ensemble.\n\n\nLocalisation: 18 rue Bourjembois\nVille: Lille\nDate de début: 2025-12-17 13:30:00+00:00\nDate de fin: 2025-12-17T16:00:00+01:00\n\n\nAge Min:\n\n5.0\nAge Max: 99.0', 'Title:\n\nAtelier créatif\nDescription:\n\nParticipez à notre atelier parents\n\n-enfants spécialement conçu pour les enfants de 5 à 10 ans, une expérience INDISPENSABLE à vivre en binôme !\n\nCet atelier privilégie la complicité et l’échange entre l’enfant et son parent, autour d’activités ludiques et éducatives qui renforcent le lien familial.\n\nOrganisé par L’École et son quartier, ce moment convivial invite petits et grands à partager ensemble.\n\n\nLocalisation: 18 rue Bourjembois\nVille: Lille\nDate de début: 2025-10-23 12:30:00+00:00\n\n\nDate de fin: 2025-10-23T16:00:00+02:00\n\n\nAge Min:\n\n5.0\nAge Max: 99.0', 'Une trace de ces échanges prendra ensuite la forme d’une critique écrite, publiée par les Démêlées.\n\nPlus d’infos sur place le soir-même.\n\n\nLocalisation: 70 Rue des Sarrazins, 59000 Lille\nVille: Lille\nDate de début: 2025-06-25 18:00:00+00:00\nDate de fin: 2025-06-25T21:00:00+02:00\n\n\nAge Min: \n\n\nAge Max:']","Oui, il existe des camps d'été pour collégiens et lycéens à Lille cet été 2025 qui correspondent à votre budget. Voici les options disponibles :

1. **Camp Cap Nord** pour les 11-14 ans, du 18 au 25 juillet, entre 250€ et 350€.
2. **Camp Meurthe et Moselle Art (54)** pour les 13-15 ans, du 18 au 31 juillet, entre 450€ et 650€.
3. **Camp des Zazous (Tarn 81)** pour les 15-17 ans, du 21 juillet au 3 août, entre 450€ et 650€.

Ces camps sont organisés par les MRJC (Mouvements Ruraux de Jeunesse Chrétienne) et offrent des activités variées pour les jeunes. Pour plus d'informations ou pour s'inscrire, vous pouvez contacter les organisateurs par email :

- Pour le camp Cap Nord : paysdeflandres@mrjc.org
- Pour le camp Meurthe et Moselle Art : hca@mrjc.org
- Pour le camp des Zazous : pasdecalais@mrjc.org

Ces options devraient convenir à vos enfants et à votre budget.",Camps d'été pour collégiens et lycéens - Pour tous les collégiens et lycéens du Nord Pas de Calais - du 18 au 25 juillet : camp Cap Nord pour les 11-14 ans entre 250€ et 350€ - du 18 au 31 : camp Meurthe et Mos'Art (54) pour les 13-15 ans entre 450€ et 650 € - du 21 juillet au 3 août : camp des Zazous (Tarn 81) pour les 15-17 ans entre 450€ et 650€ ,0.625,0.6604043123598654,1.0,0.9999999999,0.75
"Je cherche une pièce de théatre sur l'avenir. Avec tous les évènements de l'actualité, toutes ces catastrophes, peut-on encore avoir de la joie? ","['Title:\n\nEPHEMERE RETROUVAILLE\nDescription:\n\nCompagnie  BADASA\n\nTHÉÂTRE\n\nSpectacle théâtrale à la fois nostalgique et burlesque.\n\nUn questionnement sur la rencontre des individus et leur singularité.\n\nDeux personnes se retrouvent dans un espace où elles avaient l’habitude de vivre.\n\nCe sont l’Un et l’Autre.\n\nIls ne se sont pas vus depuis très longtemps.\n\nL’Un s’est perdu à force de chercher l’Autre.\n\nL’Autre s’est enfermée dans sa peur à force d’attendre l’Un.\n\nElle a presque oublié qui elle est.\n\nNe pas sortir, ne pas entrer.\n\nTout au long de la pièce, l’Un cherche des moyens pour que l’Autre se rappelle qui elle est, ce qu’elle est pour lui.\n\nFaire renaître leur histoire.\n\nC’est une urgence.\n\nL’Autre reprend vie à travers le regard de l’Un.\n\nLes rôles s’inversent.\n\nL’\n\nUn devient hésitant, indécis.\n\nIl ne veut plus sortir, ne plus entrer, par peur de ne plus voir l’Autre, par peur de la perdre pour toujours.\n\n- Artistes dramatique : Nathalie Lequertier et Adrien Mauduit\n\n- Production :\n\nCamille Hembert Site web Facebook Instagram\nLocalisation: 173 rue des Bois Blancs, 59000 Lille\nVille: Lille\nDate de début: 2025-11-27 19:00:00+00:00\nDate de fin: 2025-11-27T21:30:00+01:00\nAge Min: \nAge Max:', 'Aurore Magnier propose un OVNI\n\njoyeusement subversif où l’émotion n’est jamais bien loin. \n \n\nUn spectacle proposé par Le Théâtre du Nord, Lille \n Spectacle suivi le samedi 17 mai par un AFTERSHOW À 21H Grâce au Théâtre du Nord et à lille3000, La Ponctuelle prolonge la soirée dans l\'esprit de  Bolide  en invitant à la fête les personnes qui les font vibrer : \n \n le Couvent du Nord des Sœurs de la Perpétuelle Indulgence, pour rire et pleurer en militant, \n le Détachement International du Muerto Coco, leur compagnie jumelle qui aime crier des poèmes dans des micros, \n Koji et Claustinto qui accompagnent musicalement leurs créations et toutes deux membres du label MEGABOOMEMO, comme Viviane Lafay, l\'une des compositrices de Bolide, \n et Melon de la Vega, qui fait partie des DJ de Lille qui ambiancent les soirées de la communauté transpédébigouine locale. \n \n Ça va être dense, ça va être gai, ça va être musical, en colère, ironique et premier degré.\n\nLa Ponctuelle dira : ""voici nos copaines, vous n\'avez plus qu\'à les aimer"".\n\nGratuit, entrée libre   \n https://www.theatredunord.fr/agenda/saison-2024-2025/aftershow-bolide https://www.theatredunord.fr/agenda/saison-2024-2025/aftershow-bolide\nLocalisation: 17 Boulevard Jean-Baptiste Lebas 59000 Lille\nVille:\n\nLille\nDate de début: 2025-05-17 13:00:00+00:00\nDate de fin: 2025-05-18T17:20:00+02:00\n\n\nAge Min: 13.0\nAge Max:\n\n99.0', ""Title:\n\nOù | Cie\n\nCasa Otra\nDescription:\n\nOù  propose le temps d'une déambulation de changer de dimension, de regarder les façades et les rues en les teintant d'un nouvel imaginaire, porté par les corps de trois circassiens et de leurs acrobaties qui entreront en dialogue avec le béton, la pierre, la brique...\n\nMarcher ensemble au son d'une bande musicale en dialogue avec l'urbain.\n\nLever les yeux, ralentir le pas, ouvrir d'autres portes, tracer une autre route.\n\nIci, nous aurons désormais partagé un moment ensemble, sans nous connaître.\n\nJoignez-vous à cette balade acrobatique !\n\nspectacle dans le cadre du festival du Prato, les Toiles dans la ville #8 une coréalisation du CRAC et du Théâtre Massenet dans le cadre du vernissage festif des  Fenêtres qui parlent Retrouvez également   Où   à Bauvin, le 8 mai à 16h.\n\n\nLocalisation: rue de l’Église Saint-Louis Lille\nVille:\n\nLille\nDate de début: 2025-05-07 17:00:00+00:00\nDate de fin: 2025-05-07T19:45:00+02:00\n\n\nAge Min:\n\n5.0\nAge Max: 99.0"", 'Title:\n\nSpectacle de marionnettes ""Les musiciens de Brême""\n\n, par le Théâtre\n\nMariska\nDescription:\n\nRien ne va plus à la ferme car les animaux ont décidé de former un groupe de musique pour aller se produire sur scène dans la ville de Brême !\n\nLe fermier les chasse alors mais attention, les animaux ne vont pas se laisser faire !\n\nThe show must go on !\n\n____ Gratuit, entrée libre À partir de 2 ans.\n\nInscriptions directement sur place 30 minutes avant l\'atelier .\n\nDans la limite des places disponibles.\n\nDimanche 29 juin\n\n, 15 h à 15 h 45 --------------- Venez découvrir Môm’\n\nArt Fiesta du 26 avril au 7 septembre à la Gare Saint Sauveur.\n\nOuverture de l’exposition aux publics\n\nDu mercredi au dimanche\n\nDe 12 h à 19 h \n \n\nExposition produite par la Ville de Lille en partenariat avec lille3000 et en lien étroit avec les services de l’Académie de Lille.\n\n\nLocalisation: 17 bd Jean Baptiste Lebas\nVille: Lille\nDate de début: 2025-06-29 13:00:00+00:00\nDate de fin: 2025-06-29T15:45:00+02:00\n\n\nAge Min: \n\n\nAge Max:', 'Title:\n\nOpéra Live\n\nFaust\nDescription:\n\nOpéra\n\nLive   Faust \n \n\nDepuis 2010, l’Opéra de Lille développe des projets de captation et de retransmission de spectacles pour favoriser son rayonnement et diffuser ses nouvelles productions au plus grand nombre.\n\nAinsi, chaque fin de saison, l’évènement Opéra Live rassemble amateurs et néophytes autour d’une œuvre parmi les plus célèbres et les plus appréciées du répertoire lyrique, pour une retransmission gratuite, en direct et sur grand écran.\n\nCe rendez-vous désormais incontournable investit des lieux aussi divers que des théâtres, cinémas, salles des fêtes, châteaux, chapelles ou sites extérieurs.\n\nAssister tous ensemble à la même représentation\n\n… où que l’on se trouve !\n\nC’est l’incroyable soirée que propose l’\n\nOpéra de Lille, qui sort de ses murs pour retransmettre en direct sur grand écran et dans près de 25 lieux des Hauts-de-France,  Faust  de Charles Gounod.\n\nDe quoi vibrer de concert et abolir toutes les distances grâce au héros mythique de Goethe !\n\nMécène associé aux retransmissions live de Faust\n\n, la  Fondation d’entreprise\n\nCrédit Mutuel Nord Europe  \n\nfavorise ainsi l’accès\n\nd’\n\nun large public au répertoire lyrique\n\n. \n Les lieux de retransmission : \n Amiens Maison de la Culture Rens.\n\net résa.\n\n: +33 (0)3 22 97 79 77 accueil@mca-amiens.com \n Estaires\n\nSalle Georges Ficheux Rens.\n\net résa.\n\n: +33 (0)3 28 42 95 65 \n Fourmies Théâtre Jean Ferrat Rens.\n\net résa.\n\n: +33 (0)3 27 39 95 64 billetterie.theatre@fourmies.fr \n Haubourdin Centre culturel André Lequimme Rens.\n\net résa.\n\n:\n\n+33 (0)3 20 44 06 74 \n Jeumont Gare numérique\n\nRens\n\n.\n\net résa.\n\n: +33 (0)3 27 60 16 39 \n Le Quesnoy Théâtre des 3 Chênes Rens.\n\net résa.\n\n: +33 (0)3 27 39 82 93 c.servais@cc-paysdemormal.fr  / lequesnoy.fr \n \n\nLens\n\nMusée\n\ndu Louvre\n\n-\n\nLens Rens.\n\net résa.\n\n: louvrelens.fr \n Lille\n\nPlace du Théâtre (face à l’Opéra)\n\nRens.\n\n: +33 (0)3 62 21 21 21 \n Lomme Maison\n\nFolie\n\nBeaulieu\n\nRens\n\n.\n\net résa.']","Je suis désolé, mais je n'ai pas trouvé de pièce de théâtre sur l'avenir. En revanche, je peux te proposer d'autres événements culturels à Lille en 2025 qui pourraient t'intéresser.

- **Projection de film à la médiathèque de Lille** : À l'occasion d'Halloween, viens te faire peur devant un film choisi spécialement par l'équipe de la médiathèque. Une soirée pleine de suspense et de frissons t'attend ! (31 octobre 2025)
- **Braderie-brocante ""La Vintage"" 2025** : Organisée par l’Union Commerciale Saint-André, cette grande braderie-brocante du Vieux-Lille revient le 7 juin 2025 dans tout le quartier. Plus de 500 exposants sont attendus avec du prêt-à-porter, du vintage, des pièces uniques, des objets d’occasion, des affiches, des vinyles… Une journée pleine de découvertes et de bonnes affaires !
- **Cinéma en plein air** : Projection en plein air de courts-métrages pour toute la famille ! Une occasion de profiter du beau temps et de passer une soirée agréable en extérieur. (6 juin 2025)
- **Gare en fête avec le Cirque du Bout du Monde** : Un événement gratuit et en accès libre (sauf spectacle du dimanche sous chapiteau). Découvre un village de cirque et des spectacles lors de ce week-end haut en couleurs dans le cadre de Fiesta ! (10 et 11 mai 2025)
- **Spectacle de marionnettes ""Les musiciens de Brême""** : Un spectacle de marionnettes par le Théâtre Mariska. Une histoire amusante et captivante pour toute la famille. (29 juin 2025)

J'espère que ces suggestions te plairont et te permettront de trouver des moments de joie et de divertissement malgré les défis actuels.","Creuser la joie Un avenir joyeux est-il possible ? Malgré les apparences, c’est une hypothèse à creuser, et c’est ce qu’ambitionne de faire ce spectacle plein d’énergie et empreint d’optimisme.",0.18181818181818182,0.532522476353895,0.0,0.0,0.0
Comment faire cuire un oeuf au plat?,"[""Title:\n\nLe Chœur Orphée fait sa répèt' !\nDescription:\n\nAssistez à une répétition publique du Chœur Orphée (chœur liturgique au service du diocèse de Lille).\n\nAu programme : musique liturgique et musique sacrée !\nLocalisation: terrasse sainte catherine\nVille: Lille\nDate de début: 2025-06-21 18:00:00+00:00\nDate de fin: 2025-06-21T22:00:00+02:00\nAge Min: \nAge Max:"", 'Title:\n\nCinéma Jeune Public ""Linda veut du poulet !\n\n""\nDescription:\n\nNon, ce n’est pas Linda qui a pris la bague de sa mère Paulette !\n\nCette punition est parfaitement injuste !\n\nEt maintenant Paulette ferait tout pour se faire pardonner, même un poulet aux poivrons, elle qui ne sait pas cuisiner.\n\nMais comment trouver un poulet un jour de grève générale ?\n\nDe poulailler en camion de pastèques, de flicaille zélée en routier allergique, de mémé en inondation, Paulette et sa fille partiront en quête du poulet, entraînant toute la « bande à Linda » et finalement tout le quartier.\n\nMais Linda ne sait pas que ce poulet, jadis si bien cuisiné par son père, est la clef de son souvenir perdu...\n\nAu fait, quelqu’un sait tuer un poulet ? \n APRÈS LA SÉANCE : QUIZ SUR L’UNIVERS DE LINDA VEUT DU POULET ! (45 MIN) INFOS PRATIQUES : À partir de 7 ans Durée : 1h15 de projection GRATUIT\n\nGroupes\n\nRéservations obligatoires à :   mailto: relations.publiques@lille3000.com relations.publiques@lille3000.com  ou au 03 28 52 20 01.\n\nMerci de bien vouloir vous présenter 15 minutes avant la séance.\n\nIndividuel\n\nEn accès libre, pas de réservation dans la limite des places disponibles.\n\nTout enfant doit être accompagné d\'un adulte.\n\n\nLocalisation: 17 Boulevard Jean-Baptiste Lebas 59000 Lille\nVille: Lille\nDate de début: 2025-05-14 12:15:00+00:00\nDate de fin: 2025-05-14T15:30:00+02:00\n\n\nAge Min: \n\n\nAge Max:', 'Title:\n\n""15 comptez-vous !"" : rencontre avec l\'autrice Anne Lesaffre\nDescription:\n\nUn formidable portrait de famille, un pari d\'éducation passionnant et un tableau tout en nuances d\'une époque.\n\nEn 1948, devant une assistance d’enseignants et de parents d’élèves des facultés catholiques de Lille, un industriel du Nord donne une conférence sur l’éducation hors-norme que sa femme et lui ont développée pour leurs enfants.\n\nIls en ont déjà onze et quatre autres vont suivre.\n\nManon\n\n– c’est son surnom – est la numéro douze.\n\nAvec le recul d’une vie, elle raconte.\n\nElle raconte l’histoire à la saveur aigre-douce d’une fratrie de quinze frères et sœurs qui vivent isolés de la société qui les entoure.\n\nLa demeure est grande et délabrée, le jardin immense, les enfants, livrés à eux-mêmes, y font les quatre cents coups.\n\nMais le père, marqué par la guerre, en a retenu qu’il faut rendre les jeunes physiquement et moralement aptes à vaincre.\n\nCela va signifier vie spartiate, maîtrise des émotions, courage, dignité, les principes avant tout, aux dépens des sentiments.\n\nDans ce texte superbement écrit, enlevé, où sérieux et humour se conjuguent, l’auteure soulève le voile sur une « grande famille du Nord » totalement atypique, avec réalisme quant aux dérives d’une éducation se voulant idéale, mais aussi aux enseignements qu’elle leur apportait, et avec tendresse car cette famille, c’est la sienne.\n\n\nLocalisation: 32-34 Rue Edouard Delesalle, 59000 Lille\nVille:\n\nLille\nDate de début: 2025-10-10 15:30:00+00:00\nDate de fin: 2025-10-10T18:30:00+02:00\n\n\nAge Min: 15.0\nAge Max:\n\n99.0', 'Title:\n\nMaker Faire Lille\n\n2025\n\n\nDescription:\n\nMaker Faire\n\nLille  revient (déjà) en juin et investit pour la première fois les locaux d’EuraTechnologies au cœur du quartier Bois Blancs de Lille les  13, 14 et 15 juin 2025  et il va y avoir du lourd… et aussi du beau, de l’inspirant, de l’innovant !\n\nDe très nombreux Makers, venus de toute la France, feront le déplacement pour vous embarquer dans leurs rêves d’un avenir à construire ensemble.\n\nPlus de 100 stands et animations\n\n,\n\ndes ateliers gratuits pour toute la famille, des conférences et beaucoup de surprises à découvrir durant ces trois jours.\n\nDécouvrez toute la programmation sur  https://lille.makerfaire.com/\n\nNous accueuillons les groupes scolaires ( du CP à la terminale) le Vendredi 13 Juin.\n\nGratuit sur inscription :\n\nhttps://www.eventbrite.fr/e/billets-maker-faire-lille-2025-journee-education-1245794718539?aff=oddtdtcreator\nLocalisation: 165 Av.\n\nde Bretagne, 59000 Lille\nVille:\n\nLille\nDate de début: 2025-06-13 08:00:00+00:00\nDate de fin: 2025-06-15T18:00:00+02:00\n\n\nAge Min: \n\n\nAge Max:', ""Title:\n\nBraderie de livres et CD\nDescription:\n\nGrande vente à la médiathèque : livres et CD à petits prix issus de nos collections vous attendent !\n\nC’est le moment de faire le plein de découvertes sans se ruiner.\n\nÀ vos sacs, cabas… et bonnes trouvailles !\n\nQui sait, vous repartirez peut-être avec une pépite inattendue à glisser dans votre bibliothèque ou votre platine.\nLocalisation: 134 Rue de l'Abbé Aerts, 59000 Lille\nVille: Lille\nDate de début: 2025-10-11 12:00:00+00:00\nDate de fin: 2025-10-11T18:00:00+02:00\nAge Min: \nAge Max: 99.0""]","Je suis désolé, mais je ne peux pas répondre à cette question car elle ne concerne pas les événements culturels de 2025. Je suis là pour vous aider avec des informations sur les événements culturels de 2025. N'hésitez pas à me poser des questions sur ce sujet!","Je ne peux pas fournir des informations sur comment cuire un oeuf au plat. Par contre, je peux vous recommander des évènements culturels.",0.25,0.0,1.0,0.0,0.0
